Genre,Reports,Age,Gpa,Year,Count,Gender,Nationality
Health and Well-being Support,The campus smoking area is right next to the main entrance exposing all to smoke.,28,3.62,4,1,M,Malaysia
Food and Cantines,There are no healthy snack or fruit options available at any campus outlet.,19,2.96,1,1,F,Egypt
Health and Well-being Support,There is no crisis intervention team available on campus for mental health emergencies.,18,3.68,5,1,F,Pakistan
Online learning,The university does not provide data allowances to students for live sessions.,28,0.31,5,1,F,Saudi Arabia
Student Affairs,The appeals process for academic decisions is so complex it discourages students.,23,0.77,1,1,F,Pakistan
Student Affairs,Student affairs staff are consistently dismissive when students come forward.,20,3.89,5,1,F,Pakistan
International student experiences,International students are rarely represented in any official university communications.,28,0.5,1,1,M,Malaysia
Student Activities,Activity subsidies for low-income students are not advertised anywhere on campus.,22,3.75,2,1,F,Egypt
Student Affairs,There is no anonymous reporting channel for academic misconduct or harassment.,18,3.3,2,1,M,Saudi Arabia
Academic Support and Resources,Office hours are only once a week and always clash with my other classes.,27,1.93,2,1,M,Egypt
Health and Well-being Support,The campus smoking area is right next to the main entrance exposing all to smoke.,23,1.47,3,1,F,Egypt
Academic Support and Resources,"The academic workload is causing significant stress and anxiety, and I am finding it hard to cope with the pressure.",24,3.85,1,1,M,Soudan
Housing and Transportation,The bus stop at the North End is obscured by overgrown bushes. Drivers can't see students waiting there and often drive right past.,27,2.54,5,1,F,Malaysia
Housing and Transportation,"16. ""The public transportation system is often overcrowded and noisy, which makes it hard to concentrate on studying or getting any work done.""",26,2.51,3,1,M,South Africa
Housing and Transportation,The dormitory has no recycling system making it impossible to be sustainable.,17,0.31,3,1,F,Indonesia
Internship Opportunities,The university does not facilitate connections with startups or small businesses.,20,2.8,1,1,M,Nigeria
Food and Cantines,The canteen does not cater for students with specific dietary requirements.,25,2.29,4,1,F,Pakistan
Health and Well-being Support,The wellness app promoted by the university requires an expensive paid subscription.,19,0.81,2,1,M,Egypt
Financial Support, I wish there were more scholarships available specifically for students in my major.,20,2.48,5,1,F,Egypt
Internship Opportunities,There are no career resources available in languages other than English.,25,2.7,3,1,M,India
Online learning,I cannot download my own submitted assignments from the portal to keep records.,19,2.2,5,1,F,Pakistan
Student Affairs,"""The student affairs office needs to streamline their processes for managing birth certificates. It shouldn't take weeks to get a simple document processed.""",16,2.96,5,1,M,Mexico
Athletics and sports,The university cancelled the inter-faculty sports league without explanation.,26,3.48,2,1,F,Egypt
Financial Support,I'm worried about how I'm going to afford rent and utilities once I graduate and have to start paying back my loans.,18,2.55,3,1,M,Egypt
Internship Opportunities,There is no alumni database for students wanting career advice from graduates.,16,3.76,2,1,F,Egypt
Financial Support,There is no financial literacy guidance offered to first-year students.,23,3.06,1,1,M,Malaysia
Academic Support and Resources,"Managing the academic workload is a challenge, especially since the course material is so difficult. I need to balance work and academic responsibilities, but there are often time conflicts with other commitments. The lack of sleep is starting to take its toll on my mental health, and I'm feeling stressed and anxious.",22,3.63,1,1,F,Soudan
Health and Well-being Support,"Just like there is a space for prayer in front of the Mechanical Department, a similar space should be provided in front of almost every department for prayers.",16,1.42,1,1,F,Bangladesh
Online learning,"Projectors have inadequate resolution and do not display colors properly, which causes issues in several lectures. Please look into it.",27,0.66,5,1,F,Egypt
Financial Support,The financial aid committee decisions are never explained to unsuccessful applicants.,21,3.28,3,1,F,Malaysia
Health and Well-being Support,Students with anxiety receive no special accommodation during oral presentations.,19,2.93,4,1,M,India
Housing and Transportation,are in need of bookshelf in female prayer room. This is affecting regular activities.,20,1.29,3,1,M,Malaysia
Internship Opportunities,Career office staff turnover is so high students constantly lose their point of contact.,21,2.47,2,1,F,Bangladesh
International student experiences,International students pay higher fees but receive noticeably fewer support services.,21,1.29,2,1,M,Jordan
International student experiences,The international student support portal is only available in English.,22,3.99,2,1,M,Pakistan
Health and Well-being Support,There are no mindfulness sessions available during the high-stress exam period.,25,1.04,4,1,F,Nigeria
International student experiences,There is no welcome desk to direct new international students on arrival.,27,0.94,3,1,F,Saudi Arabia
Academic Support and Resources,The exam timetable was released less than two weeks before exams started.,19,3.46,1,1,F,Pakistan
Financial Support,The financial aid portal crashes every time I try to submit my application.,24,3.71,2,1,M,Nigeria
Student Activities,"3. ""I've been feeling really burned out lately, and I think it's because I haven't had a chance to take a break and do something fun outside of class. I wish there were more social events and activities on campus that were geared towards stress relief and self-care.""",18,3.11,4,1,M,Yemen
Student Activities,Activity subsidies for low-income students are not advertised at all.,21,2.58,1,1,F,Pakistan
Health and Well-being Support,There are no mindfulness sessions available during the high-stress exam period.,20,2.66,3,1,M,Bangladesh
Financial Support,"Bank challan not accepted at the counter. I stood in line for three hours only to be told the format changed this morning. No one informed the students. I have the cash and the old form, and today is the deadline. Please accept the payment or provide a grace period.",20,2.42,2,1,F,Pakistan
Academic Support and Resources,The library does not have enough copies of the required textbooks for my course.,22,0.81,4,1,M,India
Online learning,Students receive no notification when new materials are uploaded to the portal.,21,3.83,3,1,F,Turkey
Housing and Transportation,More female washrooms would be really appreciated. Kindly verify and take action.,24,2.54,5,1,M,Egypt
Student Activities,The student union AGM is held without proper notification to all members.,19,3.15,4,1,F,Jordan
Internship Opportunities,Students are never taught salary negotiation skills or how to read a contract.,16,0.65,3,1,M,Bangladesh
Financial Support, I'm worried that I won't be able to afford to attend this university next semester if tuition rates continue to increase.,25,2.98,3,1,F,Egypt
Housing and Transportation,Extension cables in labs are damaged.,26,0.95,3,1,M,Jordan
Housing and Transportation,"Request for better weather stripping on the balcony door. During the rain yesterday, water seeped under the door and soaked my rug. A simple rubber strip at the bottom of the door would prevent this from happening again.",16,2.26,2,1,M,Saudi Arabia
Academic Support and Resources,The library's air conditioning is so loud it makes concentrating very difficult.,25,1.37,3,1,M,Pakistan
Academic Support and Resources,"The course material is much more difficult than I expected, and I am finding it hard to understand and retain the information.",23,2.8,1,1,M,Soudan
Financial Support,"Placement registration blocked due to 'Incomplete Fee' status. My bank statement shows all payments are up to date, but the accounts branch says there's a 50 rupee discrepancy from 2023. This tiny error is stopping me from applying to the Top 3 companies visiting campus tomorrow. Please resolve this technical glitch now.",28,2.11,3,1,F,Indonesia
Student Activities,Student club rooms are double-booked constantly with no resolution process.,28,0.41,1,1,M,Bangladesh
Housing and Transportation,"I had a flat tire on my bike and tried to use the bus, but the bike rack was broken and wouldn't lock. I had to leave my bike behind and now it's been stolen.",20,1.99,2,1,M,Egypt
Food and Cantines,The canteen does not cater for students with specific dietary requirements.,25,1.08,4,1,M,Saudi Arabia
Housing and Transportation,Roommate has locked themselves in and is not responding. I have been knocking for an hour and can hear their alarm going off. I am worried about their health. We need a master key to check on them immediately.,25,1.52,4,1,F,Indonesia
Health and Well-being Support,The campus has no accessible facilities for students with certain physical conditions.,16,3.03,2,1,F,Nigeria
Online learning, Limited availability of professors during online classes has made it difficult to get timely feedback and support on coursework.,24,2.69,1,1,M,Mexico
Academic Support and Resources,I am struggling with lack of sleep and fatigue due to the demands of my academic workload.,18,2.46,1,1,M,Soudan
Academic Support and Resources,"The stress and anxiety of college life has been really overwhelming, and it's been affecting my mental health.",26,1.73,1,1,F,Soudan
Student Affairs,The academic integrity policy is applied very inconsistently across departments.,23,1.26,1,1,F,Indonesia
Housing and Transportation,"I found a set of car keys on the 9:00 AM bus. They have a Toyota keychain. I gave them to the driver, just letting the office know in case someone calls.",22,3.46,3,1,M,Nigeria
Internship Opportunities,There are no mock interview sessions offered to help students prepare for jobs.,27,1.87,5,1,F,Malaysia
Student Activities,Travel reimbursements for club trips require receipts submitted within 24 hours.,18,0.36,2,1,M,Pakistan
Student Activities,Social events on campus never cater to students from minority cultural backgrounds.,27,1.75,2,1,M,Indonesia
Student Affairs,Student representatives on the board have no real decision-making power at all.,28,0.63,1,1,M,Nigeria
Student Activities,Student leadership training is only available to elected representatives.,18,0.93,2,1,F,Turkey
International student experiences,The international student support portal is only available in English.,24,0.54,2,1,F,Jordan
Academic Support and Resources,Course coordinator changed the project requirements 24 hours before the submission. We have spent two months on the original brief and it is impossible to redo the entire architecture in one day. This will lead to a mass failure for the entire batch. We need the original rubric restored or a one-week extension.,25,2.15,3,1,F,Pakistan
Housing and Transportation,The water cooler in the faculty block is leaking. There is a constant puddle of water on the wooden floor which is starting to warp the planks. It looks like the internal drainage pipe is disconnected. Please fix the leak to save the flooring.,25,0.95,4,1,M,Bangladesh
Financial Support," Even with financial aid, I'm struggling to make ends meet while in college.",16,1.04,2,1,M,Egypt
Health and Well-being Support,The campus clinic only accepts walk-in patients in the morning with no afternoon slots.,24,2.83,5,1,F,Pakistan
Student Affairs,"The emergency exit sign in the auditorium is burnt out. If there was a power outage, it would be impossible to find the way out in the dark.",18,0.49,2,1,M,India
Student Activities,There are no virtual event options for students who cannot attend in person.,22,0.86,1,1,M,Egypt
Online learning,There is no dedicated IT helpdesk specifically for online learning problems.,20,0.57,4,1,M,India
Health and Well-being Support, Dealing with medical bills and insurance claims is a full-time job,18,0.19,2,1,F,France
Online learning,Campus Wi-Fi speed and coverage are insufficient; the signal does not reach inside classrooms. Needs attention.,23,3.76,5,1,M,Nigeria
Academic Support and Resources,There have been several honor code violations in this course and it's really disappointing. I thought this was a place of higher learning and respect for academic integrity.,16,3.3,2,1,F,Egypt
Academic Support and Resources,New books requested by students are never added to the library collection.,24,0.92,4,1,M,India
Student Affairs,I’d like to report that the admin office is frequently closing 15 minutes earlier than the posted time. I got there at 4:15 yesterday and the doors were already locked.,22,3.3,5,1,F,Saudi Arabia
International student experiences,I was not told my visa did not allow me to work more than 20 hours per week.,25,1.36,1,1,M,India
Housing and Transportation,The dormitory has had repeated pest infestations that have not been resolved.,18,2.05,1,1,F,Jordan
Athletics and sports,The running track is shared with the football team with no clear separation.,20,1.56,2,1,M,Bangladesh
Health and Well-being Support,Health education sessions are scheduled during peak lecture hours each week.,21,1.74,5,1,M,Indonesia
International student experiences,International student societies lack adequate funding to run meaningful events.,27,3.44,3,1,M,Nigeria
Academic Support and Resources,Inadequate Charging ports in library /reading room,27,0.59,3,1,M,Jordan
Academic Support and Resources,Office hours are only once a week and always clash with my other classes.,26,2.12,5,1,F,Jordan
Internship Opportunities,The career center gives identical generic advice regardless of academic discipline.,21,2.75,2,1,F,Indonesia
Academic Support and Resources,There are no study skills workshops offered to help students improve academically.,27,0.5,5,1,F,Pakistan
Housing and Transportation,Steam pipe leak in the mess kitchen. A high-pressure valve has started leaking hot steam near the cooking vats. It is too dangerous for the staff to prepare dinner. We need a mechanical technician to replace the valve so the kitchen can resume operations.,23,1.36,3,1,M,Jordan
Academic Support and Resources,The library does not have enough copies of the required textbooks for my course.,22,0.7,1,1,F,Indonesia
Student Affairs,Student complaints are routinely dismissed without any proper investigation.,20,2.9,4,1,F,Bangladesh
International student experiences,The university offers no local cultural orientation for newly arrived students.,23,0.82,3,1,F,Jordan
Internship Opportunities,The process for getting an internship approved for academic credit is too complex.,19,3.62,4,1,M,Saudi Arabia
Academic Support and Resources,Office hours are only once a week and always clash with my other classes.,26,1.75,5,1,M,Turkey
Financial Support,Late payment penalties are applied even when the delay was caused by the system.,19,2.87,2,1,F,Egypt
Online learning," I had to spend a lot of money on additional technology and equipment to participate in my online classes, which was a financial burden.",16,3.79,5,1,F,Mexico
Financial Support,The bursary requires so many documents it takes months just to apply.,28,1.33,5,1,M,Malaysia
Student Activities,Club funding applications are rejected without any written explanation provided.,25,3.27,2,1,M,Saudi Arabia
Academic Support and Resources,"The library closes at 9pm on weekdays, making late-night studying impossible.",24,3.18,5,1,M,Malaysia
Housing and Transportation,There are no covered walkways between the dormitory and main academic buildings.,22,1.92,4,1,M,Saudi Arabia
Housing and Transportation,Maintenance requests for dorm repairs are submitted but never acted upon.,20,3.88,2,1,F,Bangladesh
Online learning,Zoom links for online classes are frequently broken or shared incorrectly.,27,2.82,5,1,F,Saudi Arabia
Internship Opportunities,Graduate employment statistics on the website have not been updated in two years.,16,3.08,1,1,M,Saudi Arabia
Food and Cantines,Portion sizes at the canteen have become noticeably smaller while prices rose.,16,1.35,4,1,M,Bangladesh
Housing and Transportation,Dormitory residents are charged for damages they did not cause with no appeal.,28,2.79,2,1,M,Egypt
Health and Well-being Support,There are no mindfulness sessions offered during the exam period when stress peaks.,22,0.8,3,1,M,Malaysia
Housing and Transportation,The door to the storage room has a few old stickers on it that are half-peeled. Removing them and cleaning the adhesive would make the hallway look much tidier and more official.,27,2.78,5,1,F,Bangladesh
Academic Support and Resources,I cannot renew my library books online because the system is always down.,24,1.1,3,1,M,Malaysia
Housing and Transportation,"The gym treadmill has a frayed belt. It’s starting to slip when you run at higher speeds, which could cause someone to fall off. The machine is otherwise fine, but the belt definitely needs to be replaced before it snaps completely.",27,1.39,1,1,M,Bangladesh
Academic Support and Resources,The limited access to technology and software is hindering my ability to complete my coursework to the best of my ability.,27,0.15,1,1,F,Egypt
International student experiences,The visa extension process through the university administration is very confusing.,18,3.74,3,1,M,Jordan
Food and Cantines,Food prices at the campus canteen increased this semester without any notice.,18,0.53,4,1,F,Nigeria
Health and Well-being Support,There is no designated quiet zone for students who experience sensory overload.,28,3.84,2,1,M,Saudi Arabia
Athletics and sports,The gym does not have separate areas for cardio and strength training.,26,0.88,3,1,F,Malaysia
International student experiences,There is no translation assistance for important administrative university documents.,16,2.22,3,1,M,Indonesia
Health and Well-being Support,Health education sessions are scheduled during peak lecture hours.,27,3.74,2,1,M,Egypt
Food and Cantines,The canteen menu has not changed at all this entire semester.,20,2.58,2,1,F,Nigeria
International student experiences,International student societies lack adequate funding to run meaningful events.,22,2.59,3,1,F,Saudi Arabia
Online learning,Online quiz timers penalize students with slower internet connections unfairly.,19,3.37,3,1,F,Bangladesh
Student Affairs,"""I need my training certificate for an internship opportunity, but the student affairs office keeps giving me the runaround and hasn't provided any clear timeline for when I can expect to receive it.""",18,2.98,5,1,F,Mexico
Internship Opportunities,The career center gives the same generic advice regardless of academic discipline.,25,1.27,3,1,M,Saudi Arabia
Health and Well-being Support,The university does not conduct any annual student wellbeing surveys.,25,3.44,1,1,F,Indonesia
Financial Support,Financial aid renewal requires too many in-person documents to be submitted.,26,3.23,4,1,F,Jordan
Academic Support and Resources,"Balancing work and academic responsibilities has been a significant challenge, and I have found it difficult to maintain a healthy work-life balance.",20,1.05,1,1,F,Soudan
International student experiences,There is no community space specifically for international students to gather.,20,2.57,5,1,F,Turkey
International student experiences,"12. ""I think it would be helpful if the university provided more opportunities for international students to get involved in campus organizations and clubs. That way, we could meet more people and feel more connected to the campus community.""",27,2.58,3,1,M,France
Online learning,My online assignment was submitted on time but marked as late due to a glitch.,21,1.33,1,1,F,Jordan
Food and Cantines,The outdoor food court has no shade and students must eat in direct sunlight.,27,3.18,2,1,F,India
Food and Cantines,"26. ""The soup in the cafeteria is always too salty.""",23,3.02,5,1,F,Indonesia
Financial Support,There is no interest-free emergency loan available for students in urgent need.,23,3.96,5,1,F,Jordan
Financial Support,"Can we have a separate 'Fast Track' line for students who just need to pick up a pre-printed receipt? Currently, everyone stands in the same queue regardless of whether they are paying or just collecting a document.",25,1.39,2,1,F,Malaysia
Academic Support and Resources,New books requested by students are never added to the library collection.,20,1.0,3,1,M,Saudi Arabia
Online learning,The online attendance tracking system records incorrect absences for students.,23,2.96,5,1,F,Pakistan
Food and Cantines,Food from the canteen frequently causes stomach problems among students.,22,3.78,2,1,F,Jordan
Athletics and sports,Sports fields are regularly closed without any advance notice to students.,22,1.15,1,1,M,Jordan
Student Affairs,"I think I left my wallet in the cafeteria around 12:30 PM. It’s a small black cardholder with my student ID and some cash. If anyone turned it in, please let me know.",22,2.36,2,1,M,India
Health and Well-being Support,The university does not partner with community health services to expand access.,23,3.79,5,1,M,Indonesia
Online learning,There is no technical support available during online exams when problems arise.,20,3.96,5,1,F,Egypt
International student experiences,There are no prayer rooms available for religious international students on campus.,19,0.57,1,1,M,India
Student Affairs,There is no safe space or dedicated resources available for LGBTQ+ students.,24,2.19,2,1,M,Nigeria
Financial Support,Students are never told about external scholarships the university knows about.,19,2.7,4,1,F,Jordan
Health and Well-being Support,There is no sleep health program available for students during examination season.,16,2.7,1,1,F,Egypt
International student experiences,I was excluded from a study group because of my accent with no action taken.,16,0.93,3,1,M,Jordan
Online learning,Video playback on the learning portal buffers even on a stable connection.,22,1.41,1,1,F,Saudi Arabia
Student Affairs,University sexual harassment policies are not clearly communicated to all students.,17,3.23,2,1,M,Indonesia
Health and Well-being Support,Mental health support groups are not available in any language other than English.,26,0.76,3,1,F,Turkey
Internship Opportunities,The career office does not help students who receive poor internship evaluations.,17,0.94,5,1,F,Malaysia
Health and Well-being Support, It's frustrating that my health insurance doesn't cover all of my medical expenses.,27,3.71,1,1,F,France
Food and Cantines,"14. ""The cafeteria is always very crowded during lunchtime, which makes it difficult to find a place to sit and eat.""",20,4.21,1,1,F,Indonesia
Housing and Transportation,The 11:00 PM shuttle stop is located in a very isolated area with no CCTV. I saw someone suspicious hanging around there last night and I think the stop should be moved closer to the well-lit main road for student safety.,22,1.52,5,1,M,Saudi Arabia
Athletics and sports,The gym closes at 8pm which is too early for students with evening lectures.,19,0.55,4,1,F,Egypt
Internship Opportunities,There is no alumni database for students wanting career advice from recent graduates.,22,0.68,3,1,M,India
Student Activities,There are no virtual event options for students who cannot attend events in person.,25,0.49,1,1,F,Saudi Arabia
Academic Support and Resources,Limited access to technology and software is preventing us from being able to complete assignments on time and to the best of our ability.,27,0.57,2,1,F,Egypt
Student Affairs,The student handbook is severely outdated with policies that are no longer enforced.,19,3.06,3,1,F,India
Athletics and sports,Sports scholarships are only available for a handful of popular sports.,28,1.37,5,1,M,India
Student Activities,The university does not recognize student volunteers with any formal academic credit.,25,2.18,3,1,F,Saudi Arabia
Food and Cantines,There are no 24-hour food options for students who study late on campus.,27,3.67,1,1,F,Egypt
Athletics and sports,There is no female-only gym session available despite multiple student requests.,23,3.71,1,1,M,Jordan
Food and Cantines,The canteen queue during lunch can take over 40 minutes on a busy day.,22,3.44,3,1,M,India
Student Affairs,"Can we get a clearer map of the administrative building? Finding the ""Student Accounts"" window is like trying to navigate a maze.",20,0.51,4,1,M,Turkey
Student Affairs,"My student email is being flooded with ""Admin Notifications"" for events I never signed up for. Is there a way to opt out of these mass emails?",27,1.22,4,1,F,Turkey
Student Affairs,I faced discrimination on campus and the university took no meaningful action.,19,1.46,5,1,F,India
Internship Opportunities,There is no support for students who want to pursue freelance careers.,26,1.76,2,1,M,Jordan
Student Affairs,Student complaints filed online are regularly lost in the system with no follow-up.,16,0.57,5,1,F,Malaysia
Academic Support and Resources,The 'Study Group' sign-up sheets on the wall are always falling off because of the wind. Using a proper clipboard or a magnetic board would keep the information more secure for the students.,22,1.72,3,1,F,Indonesia
Housing and Transportation,The campus has no safe drop-off zone for students using rideshare apps.,23,2.18,5,1,F,Egypt
Housing and Transportation,"I think I left my phone on the seat of the Green Line bus. It's a black iPhone. If anyone finds it, please call the admin office. I need it for my multi-factor authentication for my exams.",16,2.2,2,1,F,Pakistan
Health and Well-being Support,There is no crisis intervention team available on campus for mental health emergencies.,27,2.65,3,1,F,Bangladesh
Athletics and sports,There is no mental health support specifically available for student athletes.,21,2.4,2,1,F,Indonesia
