Genre,Reports,Age,Gpa,Year,Count,Gender,Nationality
Student Affairs,My Pell Grant disappeared from my financial aid package overnight. I haven't changed my status or my income. I need to know what happened to my funding.,24,0.54,4,1,M,Indonesia
Student Activities,Many clubs are completely inactive and never deliver on their promised activities.,28,2.63,5,1,M,Malaysia
Athletics and sports,Athletic achievements of students are rarely acknowledged or celebrated publicly.,17,2.11,3,1,M,Pakistan
Student Activities,There are no creative arts performance spaces available for student club events.,24,3.41,3,1,M,Pakistan
Food and Cantines,The size for the teacup in the cafeteria should be larger. Please look into it.,23,3.37,1,1,F,Pakistan
Academic Support and Resources,"The lack of access to academic advisors is really frustrating, especially when I need help with scheduling or resolving academic issues.",19,1.5,1,1,F,Egypt
International student experiences,The university does not facilitate connections between students from the same country.,23,1.61,4,1,M,Nigeria
Athletics and sports,There are no gym staff available to help students use equipment safely.,25,0.61,2,1,M,Saudi Arabia
Internship Opportunities,Graduate employment statistics on the website have not been updated in two years.,23,1.9,3,1,F,Nigeria
Housing and Transportation,Dormitory residents are charged for damages they did not cause with no appeal.,23,3.76,4,1,M,Pakistan
Online learning,Production API throttled after WAF change. Clients receive HTTP 429 across endpoints. Suspect new rate limit policy. Please confirm limits and burst behavior. Funding portal calls are throttled. Need rollback or higher quotas ASAP. We’ll adjust client backoff accordingly. ETA requested.,21,3.87,4,1,M,Indonesia
Student Affairs,I just found out that my financial aid was reduced by 50% without any prior notice. I can't afford the remaining balance and I’ll have to drop out this week if this isn't corrected.,22,0.84,5,1,F,Jordan
Athletics and sports,The gym does not have enough free weights and students wait a very long time.,25,2.62,2,1,M,Jordan
Academic Support and Resources,Library study rooms can only be booked for one hour which is not enough time.,17,0.46,2,1,M,Bangladesh
Housing and Transportation,There is no 24-hour security presence in student dormitory buildings.,24,0.93,1,1,F,Saudi Arabia
Online learning," It's frustrating to have to rely on technology for my education, especially when it's not always reliable or user-friendly.",18,3.96,2,1,F,Mexico
International student experiences,"4. ""I appreciate the efforts the university has made to create a diverse and inclusive environment, but as an international student, I still feel like an outsider. It's hard to find common ground with people who have such different experiences and perspectives.""",24,0.47,5,1,F,France
Student Affairs,Some boys think they can talk in whatever way they want with the girls . This is affecting regular activities.,23,0.83,3,1,F,Saudi Arabia
Online learning,Pre-recorded lectures are too long and have no interactive elements at all.,27,1.35,4,1,M,Nigeria
Food and Cantines,The campus convenience store is always out of basic student necessities.,16,2.98,3,1,M,Jordan
Athletics and sports,The sports association AGM is held without proper notification to all students.,23,1.16,4,1,F,Egypt
Housing and Transportation,Lights in the parking basement flicker frequently.,26,3.94,2,1,M,Pakistan
Academic Support and Resources,"I have been finding it difficult to balance my academic workload with other commitments, such as extracurricular activities and social life.",16,2.85,1,1,M,Soudan
Housing and Transportation,I saw a group of non-students using the shuttle to get across town. This made the bus too full for actual students who pay for this service through their fees. There should be an ID check.,22,0.35,3,1,F,Turkey
Health and Well-being Support,The university does not conduct any annual student wellbeing surveys.,28,0.41,3,1,F,Indonesia
Student Activities,There is no inter-university collaboration or joint event program available.,16,2.61,2,1,M,Pakistan
Student Activities,Club budgets are cut mid-semester without any notice to the affected clubs.,19,3.76,1,1,F,Turkey
Food and Cantines,The campus vending machines are always empty and rarely restocked.,26,3.78,3,1,F,Jordan
Student Activities,Student leadership training is only available to formally elected representatives.,23,0.96,5,1,F,Indonesia
Student Affairs,Student complaints are routinely dismissed without any proper investigation.,27,0.6,2,1,F,Bangladesh
Internship Opportunities,The university career fair only runs once a year which is not enough.,17,0.45,2,1,F,India
Academic Support and Resources,"I'm finding the academic workload really overwhelming, and it's been a struggle to keep up with all the assignments.",18,0.69,1,1,F,Egypt
International student experiences,"13. ""It can be difficult to navigate social situations with international students because there are often cultural norms and expectations that I'm not familiar with. I wish there were more resources available to help bridge these gaps.""",19,3.19,4,1,F,France
International student experiences,The university does not proactively check on international student welfare during breaks.,23,3.6,5,1,F,Malaysia
Online learning,The university e-learning platform crashes every time I try to submit an assignment.,20,2.57,2,1,M,Pakistan
Student Affairs,"The anti-discrimination policy is vague, poorly enforced, and rarely followed.",21,2.59,2,1,F,Indonesia
Student Activities,Cultural nights are always cancelled due to budget issues at the last minute.,18,1.19,5,1,M,Saudi Arabia
Food and Cantines,The canteen queue during lunch can take over 40 minutes on a busy day.,17,0.82,1,1,F,Jordan
Financial Support,My student loan disbursement has been delayed by over three months this semester.,25,3.23,1,1,M,Saudi Arabia
Housing and Transportation,I have complain regarding the routing system of the bus.... Students go through a lot of problems to track location of the bus during arrival and departure . We know we have a msngr group where sometimes update is given but sometimes there is no update so it's a hassle... I would be better if and app system is give to know about the location of the bus upon arrival and departure. As during departure the bus doesn't always remain in same place as a result students get confused. This is affecting regular activities.,18,0.76,1,1,M,Turkey
Housing and Transportation,The shuttle route is very bumpy near the construction site. It’s hard to write or work on a laptop during the commute. Could the path be rerouted slightly?,17,0.6,4,1,F,Turkey
International student experiences,"14. ""I appreciate the efforts of the university to create a welcoming environment for international students, but sometimes it feels like a lot of the burden is placed on us to adapt and assimilate. It would be nice to have more support and understanding from the rest of the campus community.""",18,2.37,2,1,F,France
Student Activities,There are no virtual event options for students who cannot attend events in person.,17,0.62,3,1,M,Jordan
International student experiences,There is no community space specifically for international students to gather.,20,2.11,5,1,F,Egypt
Academic Support and Resources,I am concerned about my mental health and have been experiencing symptoms of depression and anxiety due to the academic workload.,21,3.19,1,1,F,Soudan
Internship Opportunities,Career mentoring is only available during office hours when students are in class.,25,1.84,5,1,F,Pakistan
Academic Support and Resources,The campus has no quiet study spaces available after 9pm for working students.,23,3.73,3,1,M,Saudi Arabia
Online learning,"Online classes are a convenient way to learn, but the technical difficulties I faced this semester made it very frustrating.",26,0.93,3,1,M,Mexico
Financial Support,The financial aid committee decisions are never explained to unsuccessful applicants.,23,0.65,1,1,M,Indonesia
Athletics and sports,The gym locker rooms are poorly maintained and frequently left in a dirty state.,18,2.56,5,1,F,Saudi Arabia
Student Activities,Club budgets are cut mid-semester without any notice given to affected clubs.,17,1.84,3,1,M,Pakistan
Online learning,The university does not provide data allowances to students for live sessions.,21,1.57,5,1,F,Saudi Arabia
Food and Cantines,There are no healthy snack or fruit options available at any campus outlet.,20,0.39,4,1,F,Egypt
Health and Well-being Support,The wellness app promoted by the university requires a paid subscription.,19,3.63,5,1,M,Malaysia
Online learning,Online peer review assignments are poorly structured with no useful guidance.,17,2.75,3,1,M,Bangladesh
International student experiences,The university does not proactively check on international student welfare during breaks.,28,3.54,4,1,F,Saudi Arabia
Internship Opportunities,The university does not offer any CV review support to students before graduation.,26,2.71,3,1,M,Indonesia
Housing and Transportation,The dormitory walls are so thin that noise from neighbors makes sleeping impossible.,24,1.9,5,1,M,Malaysia
Health and Well-being Support,There is no sleep health or fatigue program available during the exam period.,26,2.55,4,1,M,India
Student Activities,Student leadership training is only available to elected representatives.,23,1.31,1,1,M,Bangladesh
International student experiences,"2. ""As an international student, I often feel left out in group activities as most students prefer to converse in their native language.""",22,0.55,4,1,F,France
Internship Opportunities,Career development is not embedded into any course curricula across the university.,20,1.93,1,1,M,Turkey
Online learning,Online peer review assignments are poorly structured with no useful guidance.,28,0.53,1,1,M,Indonesia
Student Activities,Event approval from administration takes so long that deadlines are missed.,25,0.95,2,1,M,India
Financial Support,I was denied financial support despite clearly meeting all the listed requirements.,20,2.63,5,1,F,Egypt
Athletics and sports,There are no indoor sports facilities on rainy days for outdoor sports teams.,28,2.19,3,1,F,Indonesia
Health and Well-being Support,Students are not screened for mental health issues when they first enroll.,25,1.09,2,1,F,Jordan
Financial Support,There is no payment plan available for students struggling to pay fees on time.,21,1.3,2,1,M,India
Academic Support and Resources,Library study rooms can only be booked for one hour which is not enough time.,26,1.21,5,1,F,Egypt
Online learning,"HDMI cables in theory classrooms are mostly faulty, causing inconvenience for faculty members and resulting in loss of lecture time. Please look into it.",26,2.76,2,1,M,Jordan
Financial Support,My student loan disbursement has been delayed by over three months this semester.,23,3.21,2,1,F,Turkey
Health and Well-being Support,There are no wellness check-ins built into the program for at-risk students.,24,3.04,3,1,F,Saudi Arabia
Financial Support,There is no emergency financial assistance available for students in sudden crisis.,25,3.3,4,1,M,Malaysia
International student experiences,I was excluded from a study group because of my accent and no action was taken.,26,3.27,3,1,F,Indonesia
Online learning, The online format can make it challenging to participate in extracurricular activities and clubs.,27,0.46,5,1,M,Mexico
International student experiences,I was not told my visa did not allow me to work more than 20 hours per week.,20,2.39,5,1,M,Malaysia
Health and Well-being Support,The university does not partner with community health services to expand access.,24,3.54,2,1,M,Pakistan
Online learning,There is no dedicated IT helpdesk specifically for online learning problems.,18,3.43,4,1,F,Indonesia
Student Activities,The university does not celebrate any international awareness days on campus.,24,0.65,4,1,M,Malaysia
Health and Well-being Support,Students who disclose mental health conditions face stigma from some staff members.,26,1.48,2,1,F,Malaysia
Student Affairs,"I received a bill for ""Damaged Property"" in my dorm, but I haven't lived in that dorm for two years. The admin office has clearly mixed up my student ID with someone else's.",27,2.81,5,1,M,Egypt
Housing and Transportation,drinking water system on the 6th floor(CSE dpt) is no longer working.,18,2.89,4,1,M,Egypt
Online learning,Temporary admin rights for approved research tool. Need same-day install of a vendor SDK. Approval attached; please assign JIT elevation.,27,4.0,3,1,M,Egypt
Health and Well-being Support,The campus has no accessible facilities for students with certain physical conditions.,20,1.11,2,1,M,Pakistan
Academic Support and Resources,Suggestion to add more charging ports in the library's individual study cubicles. Most of us work on laptops for long hours and there are only a few desks with working power outlets. It would make the space much more functional.,19,2.73,2,1,F,India
Academic Support and Resources,Request for a digital map of the academic blocks to be added to the student app. The campus is large and new students often get lost trying to find specific labs or faculty rooms in the first few weeks.,24,2.34,3,1,M,Egypt
Health and Well-being Support,There is no nutrition or healthy eating education offered through the health center.,26,1.77,4,1,F,Egypt
International student experiences,The campus does not acknowledge or celebrate the cultural diversity of its students.,26,3.28,5,1,M,Pakistan
Online learning,Online course content is never updated and still contains outdated information.,22,0.72,1,1,F,Egypt
Student Affairs,"Pressure is applied to participate in co-curricular activities by seniors, even if students are unwilling or facing problems. Would appreciate a resolution soon.",19,1.17,3,1,M,Egypt
Health and Well-being Support,The campus has no accessible facilities for students with certain physical conditions.,17,1.04,1,1,F,Turkey
Internship Opportunities,The university does not organize any site visits to companies for students.,24,0.56,4,1,M,Pakistan
Athletics and sports,The sports complex has no accessible changing facilities for disabled students.,25,2.97,3,1,M,Pakistan
Academic Support and Resources,We are in need of more research facilities in our university and also we are in need of more experienced professors.,26,1.24,3,1,M,Egypt
Housing and Transportation,"The transparent glass of washroom windows should be replaced with non-transparent glass, especially in lower floors, as it is a matter of privacy. Kindly verify and take action.",21,1.46,1,1,F,Bangladesh
Financial Support,The financial aid committee decisions are never explained to unsuccessful applicants.,20,0.83,4,1,F,Jordan
Student Affairs,"The anti-discrimination policy is vague, poorly enforced, and rarely followed.",27,3.28,1,1,M,Bangladesh
International student experiences,Cultural stereotyping by some faculty makes international students feel unwelcome.,26,3.86,4,1,F,Egypt
Health and Well-being Support,The university does not conduct any annual student wellbeing surveys.,27,1.42,1,1,F,Bangladesh
Housing and Transportation,Suggestion for better lighting in the backyard path. The walkway between the hostel and the mess is very dark after 7 PM. It's easy to trip on the uneven pavement there. Adding a couple of LED lamps would make it much safer for everyone.,19,3.9,1,1,F,Jordan
Student Activities,The student union never announces events early enough for students to plan ahead.,24,2.59,5,1,M,Indonesia
Academic Support and Resources,The faculty advisor has changed three times this semester. Every time we have to explain our project progress and academic issues to a new person from scratch. We need a stable mentor for the rest of the academic year.,21,3.89,4,1,F,Jordan
International student experiences,The university does not proactively check on international student welfare during breaks.,17,3.3,2,1,F,Turkey
Housing and Transportation,Campus street lighting near student housing is inadequate and unsafe at night.,20,0.5,4,1,F,Egypt
Internship Opportunities,Graduate school application support is not offered despite many students needing it.,20,3.41,2,1,F,India
Housing and Transportation,The off-campus housing referral list provided by the university is totally outdated.,23,1.23,2,1,F,Jordan
Internship Opportunities,The career center gives the same generic advice regardless of academic discipline.,16,2.93,2,1,M,Pakistan
Health and Well-being Support,It's difficult to find affordable mental health care services.,22,3.88,4,1,F,France
Athletics and sports,The gym is severely overcrowded during peak hours with not enough machines.,22,1.86,1,1,M,Saudi Arabia
Academic Support and Resources,The library's air conditioning is so loud it makes concentrating very difficult.,26,1.0,3,1,M,Nigeria
Student Activities,Cultural nights are always cancelled due to budget issues at the last minute.,26,0.55,3,1,M,Egypt
International student experiences,There is no free local language program for students who are not native speakers.,27,2.4,3,1,M,Egypt
Student Activities,There is no inter-university collaboration or joint event program available.,21,1.72,3,1,F,Turkey
Financial Support,Financial support is only available to full-time students excluding part-timers.,21,2.5,5,1,M,Nigeria
Academic Support and Resources,Request for a designated 'Quiet Zone' in the department lobby. It’s a good place to read between classes but it gets very noisy when people are talking loudly on their phones. A few 'Silence Please' signs might help.,21,1.92,4,1,M,Nigeria
Financial Support,The 'Annual Report' on student welfare funds hasn't been posted in the lobby this year. We always like to see how the student activity fees are being utilized for campus events and sports equipment.,24,0.93,2,1,F,India
Academic Support and Resources,Library and study room spaces are insufficient and remain overcrowded during peak hours. Requesting a quick check.,28,2.44,5,1,M,Bangladesh
Student Affairs,"I found a backpack full of expensive camera gear in the park. I’ve brought it to the lost and found, but I wanted to make sure it was logged.",26,3.71,2,1,F,India
Online learning,Online classes require a lot of self-discipline and time management skills that not all students have developed yet.,26,2.98,1,1,F,Mexico
Food and Cantines,There are no halal options available at the main cafeteria which is unacceptable.,19,1.08,1,1,M,Pakistan
Academic Support and Resources,"The industrial visit planned for this semester has been postponed three times. We have already paid the registration fee and arranged for our own transport to the hub. We need a clear, final date and an itinerary, or a full refund of the collected fees.",19,3.69,4,1,M,Saudi Arabia
Student Activities,There are no creative arts performance spaces available for student club events.,17,2.21,5,1,M,Saudi Arabia
Internship Opportunities,Career office staff turnover is so high students constantly lose their point of contact.,24,0.37,4,1,F,Saudi Arabia
Financial Support,Students supporting dependents while studying get no additional financial help.,18,0.73,2,1,F,Jordan
Academic Support and Resources,There are no study skills workshops offered to help students improve academically.,25,1.26,5,1,M,Turkey
Athletics and sports,Gym booking slots are released at midnight and fill up within minutes each time.,19,1.44,4,1,M,Malaysia
Health and Well-being Support,The wellness app promoted by the university requires a paid subscription.,24,3.87,3,1,F,Jordan
Food and Cantines,Meal plan options are too expensive and offer very poor value for students.,24,3.23,4,1,M,Bangladesh
Online learning,There is no dedicated IT helpdesk specifically for online learning problems.,19,3.18,5,1,M,Nigeria
Internship Opportunities,There are no resources for students wanting to work in careers outside the country.,16,1.22,2,1,M,India
Academic Support and Resources,We need more research facilities in our university and also we need more experienced professors,24,2.33,4,1,M,Bangladesh
Internship Opportunities,The lack of available networking opportunities makes it difficult to connect with professionals in my desired field.,17,1.89,4,1,F,Egypt
Academic Support and Resources,The library catalogue system is outdated and hard to search effectively.,18,2.55,1,1,M,India
Housing and Transportation,There are no bicycle lanes on campus making cycling to class dangerous.,24,2.75,3,1,M,Egypt
Online learning,Students receive no notification when new materials are uploaded to the portal.,17,0.46,2,1,M,Egypt
Health and Well-being Support,There are no wellness check-ins built into the program for at-risk students.,22,3.31,4,1,M,Saudi Arabia
Internship Opportunities,There are no resources for students wanting to work in careers outside the country.,17,3.49,2,1,F,Pakistan
Financial Support,There is no dedicated financial support officer for students in genuine hardship.,23,1.55,2,1,M,Indonesia
Housing and Transportation,"9. ""The housing options near campus are very limited, and many landlords take advantage of the high demand by charging outrageous prices for subpar apartments.""",20,3.27,2,1,F,South Africa
Housing and Transportation,The evening route home is consistently skipping the stop near the Engineering block. We wait there for ages and watch the bus go by on the main road without turning in. This has happened four times this week and it's very frustrating.,26,3.92,5,1,M,Egypt
Internship Opportunities,Students are never taught how to use professional networking platforms effectively.,22,1.51,2,1,F,Turkey
Internship Opportunities,The process for getting an internship approved for academic credit is too complex.,20,3.43,2,1,M,India
Housing and Transportation,The off-campus housing referral list provided by the university is totally outdated.,19,1.69,4,1,M,Pakistan
Student Affairs,"I am being charged ""In-State"" tuition even though I am an international student. I don't want to get in trouble later for a mistake the university made, so I’m reporting it now.",24,1.35,1,1,M,Indonesia
Student Affairs,There is no safe space or dedicated resources available for LGBTQ+ students.,26,3.27,3,1,M,Pakistan
Athletics and sports,The gym locker rooms are poorly maintained and frequently left in a dirty state.,16,3.0,3,1,F,Egypt
Health and Well-being Support,There is no peer counseling program run by trained student volunteers on campus.,18,0.65,4,1,F,Nigeria
Internship Opportunities,There are no mock interview sessions offered to help students prepare for jobs.,18,2.4,1,1,M,Saudi Arabia
Student Affairs,Can the university start accepting Apple Pay for on-campus admin fees? Carrying around exact change for transcript copies is very inconvenient.,28,3.09,3,1,F,Pakistan
Health and Well-being Support,The university does not conduct any annual student wellbeing surveys.,25,0.38,3,1,F,Indonesia
Food and Cantines,"20. ""The prices for food on campus are too high, especially considering the quality and variety of the options available.""",23,4.2,5,1,F,Indonesia
Food and Cantines,9. There are not enough gluten-free options available.,22,2.01,2,1,M,Indonesia
Online learning,"When student occupancy at the library increases, the Wi-Fi connection becomes very slow and frequently disconnects. This severely disrupts academic activities, research work,and online learning, making the library ineffective as a study environment during peak hours. Kindly verify and take action.",27,1.81,1,1,F,Indonesia
Academic Support and Resources,I cannot renew my library books online because the system is always down.,16,1.83,3,1,M,Egypt
Student Affairs,I was dropped from my Nursing clinicals because the admin office lost my CPR certification card. I gave them the original and now they say they never saw it. I can't finish my degree without those hours.,19,2.58,5,1,M,Turkey
International student experiences,International students pay higher fees but receive noticeably fewer support services.,28,3.23,3,1,M,Egypt
Housing and Transportation,The bus stop near campus has no shelter and students get soaked in the rain.,18,2.58,1,1,M,Turkey
Internship Opportunities,There are no resources for students applying to government or public service careers.,21,1.04,3,1,M,Nigeria
Financial Support,The financial aid application process is so confusing and time-consuming.,26,2.44,2,1,F,Egypt
Online learning,Most of the computers at the labs have problems; they should be fixed. Kindly verify and take action.,27,1.04,1,1,M,Nigeria
Internship Opportunities,Graduate employment statistics on the website have not been updated in two years.,27,1.33,1,1,F,Nigeria
Student Activities,The university does not celebrate any international awareness days on campus.,18,2.05,1,1,M,Nigeria
Online learning,Assignment submission on the portal frequently fails and loses uploaded files.,26,2.16,1,1,F,Saudi Arabia
Academic Support and Resources,We can never find our adviser. This is affecting regular activities.,25,1.72,2,1,M,Jordan
Housing and Transportation,The off-campus housing referral list provided by the university is totally outdated.,17,0.83,4,1,F,Bangladesh
International student experiences,There is no airport pickup service or arrival guidance for new international students.,21,3.08,3,1,F,India
Internship Opportunities,There are no resources for students wanting to work in careers outside the country.,20,2.66,4,1,F,Saudi Arabia
Student Affairs,I was just mugged at knifepoint behind the cafeteria. The person took my phone and my bag and ran towards the woods. I’m shaken up but not physically injured. Please send help.,24,3.43,1,1,F,Saudi Arabia
Financial Support,I was charged for a course I officially withdrew from and the refund is pending.,24,3.73,2,1,M,Egypt
Health and Well-being Support,The health center does not communicate with academic staff about student medical needs.,17,1.01,5,1,M,Indonesia
