Genre,Reports,Age,Gpa,Year,Count,Gender,Nationality
Online learning,The e-learning platform has too many broken links within core course modules.,28,2.34,1,1,M,Malaysia
Athletics and sports,There is no sports equipment repair service and broken items are never replaced.,24,2.19,2,1,F,Nigeria
Housing and Transportation,"12. ""I've had to switch apartments several times because of problems with landlords or roommates, and it's really disrupted my studies and my life.""",20,1.63,4,1,F,South Africa
Health and Well-being Support,There is no designated quiet zone for students who experience sensory overload.,23,0.47,2,1,F,Malaysia
Food and Cantines,Meal plan options are too expensive and offer very poor value for students.,24,2.08,5,1,F,Turkey
Housing and Transportation,"The morning shuttle at 8:30 AM is always completely packed. Many students are forced to stand right next to the driver's seat or wait for the next one, which makes them late for their first lecture. It would be great if an extra bus could be added for this specific slot.",16,3.82,3,1,M,Jordan
Online learning,Campus Wi-Fi speed and coverage are insufficient; the signal does not reach inside classrooms.,24,1.53,3,1,F,Jordan
Academic Support and Resources,There are no study skills workshops offered to help students improve academically.,21,0.68,1,1,F,Indonesia
Housing and Transportation,I left my lab notebook on the bus yesterday. It has all my data for my thesis. I am desperate to find it. Please let me know if it’s in the lost and found.,16,1.88,3,1,F,Bangladesh
International student experiences,The university does not proactively check on international student welfare during breaks.,24,0.65,3,1,F,Saudi Arabia
International student experiences,I was charged a currency conversion fee on tuition that was never disclosed.,23,3.22,1,1,M,Pakistan
Student Activities,Activity subsidies for low-income students are not advertised at all.,27,0.42,1,1,M,Bangladesh
Food and Cantines,There are no 24-hour food options for students who study late on campus.,22,0.51,3,1,M,Nigeria
Athletics and sports,The gym induction is only offered once per semester making access hard for new students.,19,2.3,2,1,M,Nigeria
Internship Opportunities,The process for getting an internship approved for academic credit is overly complex.,21,3.36,3,1,F,Bangladesh
Academic Support and Resources,The exam timetable was released less than two weeks before exams started.,19,3.66,4,1,M,Bangladesh
Student Affairs,Help! A fight just broke out in the courtyard between two guys and one of them looks like he’s seriously hurt. There is blood on the pavement and nobody is stepping in to stop it. Please send someone right now!,21,3.3,3,1,M,Saudi Arabia
Housing and Transportation,"Inconsistent hot water timings in the morning. The boilers are supposed to be on from 6 AM to 9 AM, but lately, the water is lukewarm by 8 AM. This is a problem for those of us with later classes. Please ensure the heating cycle is fully completed.",24,2.88,3,1,M,Pakistan
Athletics and sports,There are no beginner sports programs for students new to physical activity.,28,1.61,3,1,F,Indonesia
Food and Cantines,I found a foreign object in my meal at the university cafeteria today.,27,3.94,1,1,F,Egypt
Online learning,"Conference room console can’t join SIP/H.323 bridge. The console in the conference room wont join the SIP bridge. It just says ""Unable to connect."" We have a big meeting on Friday, need a workaround if it's not fixable.",18,1.08,1,1,M,Pakistan
Academic Support and Resources, I am really struggling with understanding the instructions for this assignment. They are not clear and I don't know what is expected of me.,26,2.5,2,1,F,Egypt
Internship Opportunities,Students from non-business disciplines receive very little career guidance at all.,21,0.36,2,1,M,Jordan
Health and Well-being Support,Students with anxiety receive no special accommodation during oral presentations.,16,2.82,1,1,M,Turkey
Athletics and sports,Sports club meetings have no dedicated room and are held in noisy common areas.,22,3.7,2,1,M,Egypt
Academic Support and Resources,I have a part-time job that's making it hard to balance my schoolwork. I'm trying to negotiate a better schedule with my employer.,25,0.97,1,1,F,Soudan
Student Affairs,Can we get more regular patrols around the back of the auditorium? It’s very dark back there and I’ve seen people who don't look like students hanging out and drinking late at night.,20,2.97,5,1,F,Egypt
International student experiences,There is no designated contact person for international students during holidays.,27,1.4,4,1,F,Egypt
Athletics and sports,There are no indoor sports facilities on rainy days for outdoor sports teams.,27,0.65,3,1,F,Jordan
Online learning, Limited availability of professors during online classes has made it difficult to get the guidance needed to succeed in the course.,19,0.36,2,1,M,Mexico
Food and Cantines,"29. ""The vending machines on campus should offer healthier options, like granola bars and trail mix.""",19,2.16,4,1,F,Indonesia
Internship Opportunities,Students are never taught salary negotiation skills or how to read a contract.,19,3.03,3,1,F,India
International student experiences,There is no translation assistance available for important administrative documents.,16,0.73,1,1,M,Malaysia
Online learning,There is no technical support available during online exams when problems arise.,21,1.8,2,1,F,Turkey
Internship Opportunities,I applied for a university-advertised internship and never received any response.,28,0.72,3,1,M,Indonesia
Food and Cantines,I found a foreign object in my meal at the university cafeteria today.,19,0.92,3,1,M,Saudi Arabia
Online learning,SSL warning on internal faculty dashboard. Browser reports certificate name mismatch. Peers report identical interstitial warnings. Is this a renewal delay or misconfiguration? Please confirm SAN entries and chain trust. Provide guidance if pinning affects clients. A short post-incident note would help. Prefer resolution before grade submission week.,27,2.68,4,1,M,Pakistan
Academic Support and Resources,Half the computers in the library are broken and have been for months.,22,3.15,2,1,M,Turkey
Student Activities,There are no creative arts performance spaces available for student club events.,28,0.68,4,1,F,Saudi Arabia
Student Activities,Cultural nights are always cancelled due to last-minute budget cuts.,17,2.81,5,1,F,Indonesia
Student Activities,Cultural clubs receive far less funding than sports clubs without any justification.,27,3.3,1,1,F,India
Financial Support,I was denied financial support despite clearly meeting all the listed requirements.,26,3.02,3,1,M,Turkey
Athletics and sports,The running track is shared with the football team with no clear separation.,26,1.02,5,1,M,Egypt
Athletics and sports,The swimming pool is closed for maintenance more often than it is open.,23,2.19,1,1,M,Bangladesh
Student Affairs,The university administration rarely communicates important policy changes to students.,23,2.5,4,1,M,Malaysia
International student experiences,My overseas academic transcripts took months to verify due to a slow process.,27,0.98,1,1,M,Indonesia
Health and Well-being Support,Health education sessions are scheduled during peak lecture hours each week.,18,3.81,1,1,M,Saudi Arabia
Academic Support and Resources,Suggestion to organize a small workshop on 'LaTeX' for the first-year students. Most of us are struggling with formatting our lab reports and a basic one-hour introductory session would be very beneficial.,19,1.05,4,1,M,Turkey
Athletics and sports,The sports complex has no accessible changing facilities for disabled students.,22,2.7,3,1,M,Egypt
Online learning,The e-learning platform has too many broken links within core course modules.,21,1.24,3,1,M,Bangladesh
Academic Support and Resources,There is no academic writing center support for postgraduate students.,27,0.98,3,1,F,Indonesia
Food and Cantines,"4. ""The food on campus is great, but the cantine is always crowded during lunchtime.""",18,4.14,3,1,F,Indonesia
Financial Support,International students pay higher fees but receive fewer financial support options.,26,3.89,1,1,F,Indonesia
International student experiences,There is no community space specifically for international students to gather.,28,3.05,5,1,M,Turkey
International student experiences,Cultural stereotyping by some faculty makes international students feel unwelcome.,24,1.22,1,1,F,Jordan
Housing and Transportation,Dormitory laundry machines are broken down or fully occupied most of the time.,19,1.75,4,1,F,India
Internship Opportunities,The university does not offer any CV review support to students before graduation.,16,2.45,2,1,M,Malaysia
Housing and Transportation,Moving in and out of dormitories is chaotically managed with no clear procedures.,18,0.77,1,1,F,Nigeria
Food and Cantines,There are no halal options available at the main cafeteria which is unacceptable.,25,2.95,5,1,F,Nigeria
Food and Cantines,22. I have been treated rudely by staff in the dining hall.,22,4.0,5,1,M,Indonesia
Athletics and sports,The gym does not have enough free weights and students wait a very long time.,19,3.84,5,1,M,Jordan
Academic Support and Resources,Assignment rubrics are vague and applied inconsistently across different lecturers.,17,1.18,3,1,M,Indonesia
International student experiences,"11. ""I appreciate the efforts of my professors and classmates to help me feel included and supported, but there are still times when I feel like I'm on the outside looking in. It's a tough position to be in.""",20,0.36,2,1,F,France
Online learning,We have a bunch of old Teams from the seniors who graduated last year. Can we just archive them all? They're just cluttering up the list.,21,3.45,2,1,M,Indonesia
Online learning,zero Wifi facilities in peak hour,21,1.24,5,1,M,Bangladesh
Food and Cantines,"12. ""The pastries in the cantine are always stale and tasteless.""",22,3.81,3,1,F,Indonesia
Student Affairs,Student complaints are routinely dismissed without any proper investigation.,19,1.06,1,1,F,India
Athletics and sports,There are no beginner-level programs for students who are new to physical activity.,16,3.99,5,1,F,Nigeria
Online learning,Decommission unused service account. We don't need the 'auto-bot-01' account anymore. It's for a project that ended. Delete it whenever.,25,3.45,2,1,M,Indonesia
Housing and Transportation,The bus stop near campus has no shelter and students get soaked in the rain.,20,1.97,1,1,M,India
Academic Support and Resources,"I have a lot of other commitments that often conflict with my schoolwork, and it's been really hard to juggle everything.",16,0.37,1,1,F,Soudan
Athletics and sports,Sports injuries during university activities are not covered by student insurance.,26,1.6,5,1,F,Jordan
Health and Well-being Support,Students with anxiety receive no special accommodation during oral presentations.,24,1.69,2,1,F,Jordan
Financial Support,The cost of required course materials is not covered by the student bursary at all.,20,3.49,3,1,M,Malaysia
Housing and Transportation,The door to the faculty restroom has a coat of paint that is slightly uneven near the bottom. It's a very minor aesthetic flaw that probably occurred during the last touch-up. Re-sanding and a quick thin coat would smooth it out.,18,1.81,4,1,M,Bangladesh
Financial Support,The scholarship application deadline was changed without notifying all students.,17,2.66,2,1,M,Indonesia
Student Activities,There are no outdoor adventure trips organized by the university this year.,18,0.76,2,1,M,Egypt
Academic Support and Resources,There is no peer tutoring program available for first-year students.,27,1.92,4,1,M,Jordan
International student experiences,The university does not provide an international student welcome information pack.,23,1.85,3,1,M,Egypt
Financial Support,The financial aid committee decisions are never explained to unsuccessful applicants.,25,1.1,3,1,M,Jordan
Student Activities,The photography and film club has no equipment provided by the university at all.,27,3.83,3,1,M,India
Internship Opportunities,There is no alumni database for students wanting career advice from recent graduates.,24,3.05,4,1,M,Bangladesh
Academic Support and Resources,"The late-entry policy for the 8 AM lecture is being applied inconsistently. Some students are allowed in at 8:15 while others are marked absent at 8:05. We need a clear, uniform rule for the entire department to avoid confusion.",25,2.2,2,1,F,Indonesia
Housing and Transportation,AC's don't work properly. Would appreciate a resolution soon.,26,1.52,3,1,F,India
Housing and Transportation,The 8:00 AM bus simply didn't show up today. A group of about 30 of us were left waiting and most of us missed our mid-term presentations. We need a more reliable service for morning peak hours.,18,0.77,3,1,F,Jordan
Internship Opportunities,"There are no career resources available in the student app, only on desktop.",26,3.6,2,1,F,Malaysia
Athletics and sports,There is no female-only gym session available despite multiple student requests.,19,1.24,2,1,F,Malaysia
Academic Support and Resources,"I'm having trouble with a particular software program for one of my classes, but there's no one available to help me troubleshoot. It's frustrating to feel like I'm on my own.",21,1.4,2,1,M,Egypt
Financial Support,There is no hardship fund for students who unexpectedly lose their income.,28,1.52,5,1,F,India
Academic Support and Resources,Library study rooms can only be booked for one hour which is not enough time.,27,3.17,1,1,F,Indonesia
Student Affairs,There is no formal process for students to give anonymous feedback on teaching.,21,3.77,3,1,M,Nigeria
Student Activities,Many clubs are completely inactive and never deliver on their promised activities.,28,3.34,2,1,F,Indonesia
Academic Support and Resources,The lack of access to research databases and materials is hindering my ability to conduct thorough research for my papers.,23,3.23,1,1,F,Egypt
Health and Well-being Support,The health center does not communicate with academic staff about student medical needs.,26,2.09,5,1,M,Bangladesh
Academic Support and Resources,Forming groups ourselves regularly leads to conflicts. It would be better if the teacher assigned the groups first to avoid any problems.,22,1.33,1,1,F,Nigeria
Financial Support,Financial support is only available to full-time students excluding part-timers.,18,3.76,3,1,M,Bangladesh
Health and Well-being Support,There is no peer counseling program run by trained student volunteers on campus.,26,0.77,1,1,F,Saudi Arabia
International student experiences,The university does not provide an international student welcome information pack.,22,2.15,5,1,M,Egypt
Online learning,The e-learning platform logs students out every 15 minutes during assessments.,17,2.92,3,1,F,Malaysia
Financial Support,There is no interest-free emergency loan available for students in urgent need.,20,2.83,3,1,F,Bangladesh
Internship Opportunities,Students are never taught how to use professional networking platforms effectively.,20,2.49,4,1,M,Turkey
Student Activities,Many clubs are inactive and don't deliver on their promised events.,21,1.26,5,1,M,Malaysia
Student Affairs,Disciplinary procedures are inconsistently applied across different departments.,28,1.0,3,1,F,Saudi Arabia
Online learning,The university e-learning platform crashes every time I try to submit an assignment.,22,0.72,5,1,M,Jordan
International student experiences,The university does not facilitate connections between students from the same country.,26,0.6,2,1,F,Bangladesh
International student experiences,"4. ""I wish there were more opportunities to learn about different cultures and interact with students from diverse backgrounds.""",21,1.78,3,1,F,France
Academic Support and Resources,The library does not stock enough academic journals in my field of study.,19,1.52,4,1,M,India
Financial Support,Students cannot download digital payment receipts.,16,2.56,2,1,F,Jordan
Housing and Transportation,"9. ""I have to walk 20 minutes to the bus stop every day, which is not ideal during the winter months.""",17,2.93,4,1,M,Yemen
Internship Opportunities,There are no career resources available in languages other than English.,16,3.64,1,1,F,Turkey
Academic Support and Resources,Limited access to technology and software is making it difficult to complete assignments and stay up to date with my coursework.,24,0.69,1,1,M,Egypt
Student Activities,The photography and film club has no equipment provided by the university at all.,28,2.81,1,1,F,Malaysia
Athletics and sports,Sports scholarships are only available for a handful of popular sports.,17,3.3,1,1,F,Saudi Arabia
Health and Well-being Support, The cost of medical treatment is preventing me from getting the care I need.,24,2.13,4,1,F,France
Student Activities,Student leadership training is only available to elected representatives.,21,0.91,3,1,M,Saudi Arabia
Student Activities,Cultural clubs receive far less funding than sports clubs without any justification.,21,2.79,5,1,F,Saudi Arabia
Student Activities,The activities calendar on the student portal is never kept up to date.,21,2.76,3,1,F,Turkey
Online learning,The university has not invested enough in its online learning infrastructure.,26,3.14,3,1,F,Pakistan
Housing and Transportation,Squeaky ceiling fan in the study hall. The fan in the corner makes a loud metallic grinding noise whenever it's on speed 3 or higher. It is very distracting for everyone trying to study in silence. A simple oiling of the motor should fix the issue.,17,3.64,4,1,M,Nigeria
Online learning,Password reset link expired mid-process. I tried to reset my password but the link expired before I could click it. Now I'm locked out of my email right before my tutorial starts. PLS RESET.,26,1.7,5,1,M,Pakistan
Internship Opportunities,The career center website is outdated and many of the resource links are broken.,22,3.91,1,1,M,Nigeria
Online learning,The online exam system timed out during my test and I lost all my answers.,17,1.33,4,1,M,Indonesia
Online learning,The university does not provide data allowances to students for live sessions.,23,1.48,5,1,F,Nigeria
Student Activities,The university does not allow clubs to seek external sponsorship independently.,22,2.22,4,1,F,Saudi Arabia
Financial Support,Suggestion for a 'Feedback Box' specifically for the accounts department. It would be a nice way for students to share their experiences with the fee payment process and suggest improvements.,22,2.47,4,1,M,Indonesia
Health and Well-being Support,The university does not partner with community health services for student access.,16,3.56,3,1,M,Indonesia
Athletics and sports,The gym induction is only offered once per semester making access hard for new students.,23,2.4,3,1,M,Egypt
Internship Opportunities,Career development is not embedded into any course curricula across the university.,18,2.26,4,1,F,Turkey
Financial Support,The cost of required course materials is not covered by the student bursary at all.,24,1.69,4,1,M,Bangladesh
Student Affairs,There is a stray dog on campus that looks very aggressive. It’s been growling at people walking to the dining hall and I’m worried it might bite a student who isn't paying attention.,22,3.37,1,1,M,Egypt
Internship Opportunities,Career development is not embedded into any course curricula across the university.,21,3.71,2,1,M,Bangladesh
Internship Opportunities,The career center website is outdated and many resource links are broken.,18,1.61,3,1,M,Bangladesh
Online learning,The course registration system crashes during peak enrollment periods every time.,17,0.95,1,1,F,Bangladesh
Housing and Transportation,My bus pass was overcharged this month. I usually pay for the student discount rate but the system took the full faculty amount. I need a refund of the difference.,19,1.5,5,1,M,Malaysia
Internship Opportunities,There are no career resources available in languages other than English.,27,1.59,4,1,M,Saudi Arabia
Athletics and sports,The gym wifi does not work so students cannot follow workout apps on their phones.,16,0.39,3,1,M,Pakistan
Student Affairs,The academic integrity policy is applied very inconsistently across departments.,19,2.85,5,1,M,Indonesia
Internship Opportunities,The internship database only lists opportunities from the same handful of companies.,21,0.87,5,1,F,Jordan
Food and Cantines,There is only one water dispenser in the entire cafeteria and it is always broken.,22,0.82,4,1,F,Indonesia
Student Affairs,"The ""Class Schedule"" search tool is down, and I need to find the room number for my 9:00 AM class. It’s 8:50 AM and I’m just standing in the quad lost.",25,2.73,4,1,M,Saudi Arabia
Food and Cantines,"12. ""The cafeteria should offer more options for students with dietary restrictions or food allergies.""",20,1.38,2,1,F,Indonesia
Financial Support,The student finance website contains outdated and incorrect information.,23,3.28,1,1,M,India
Food and Cantines,I witnessed expired products being served at a campus food stall last week.,17,0.49,2,1,M,Jordan
Food and Cantines,I witnessed expired products being served at a campus food stall last week.,18,0.65,2,1,M,Indonesia
Student Activities,The university does not recognize student volunteers with any formal academic credit.,19,3.74,1,1,F,Saudi Arabia
Athletics and sports,There are no gym staff available to help students use equipment safely.,17,2.86,1,1,M,Indonesia
International student experiences,The campus does not celebrate or acknowledge the cultural diversity of its students.,26,1.0,5,1,M,Nigeria
International student experiences,There is no designated contact person for international students during holidays.,28,3.88,3,1,F,Indonesia
Food and Cantines,The campus convenience store is always out of basic student necessities.,17,0.46,1,1,F,Malaysia
Athletics and sports,There are no beginner sports programs for students new to physical activity.,19,2.23,1,1,F,Nigeria
Athletics and sports,Sports scholarships are only available for a handful of popular sports.,24,2.21,2,1,M,Turkey
Housing and Transportation,There are no bicycle lanes on campus making cycling to class dangerous.,26,2.24,3,1,M,Bangladesh
Housing and Transportation,Power supply in the seminar room is unstable.,28,1.22,5,1,F,Indonesia
Housing and Transportation,"The shuttle service to the off-campus housing is very unreliable. Sometimes it comes, sometimes it doesn't. We pay a lot for this and expect better.",19,1.15,4,1,F,Egypt
Academic Support and Resources,I cannot renew my library books online because the system is always down.,24,3.78,1,1,F,Jordan
Online learning,Video playback on the learning portal buffers even on a stable connection.,16,3.53,2,1,F,Jordan
Student Affairs,A group of students is using the chemistry lab after hours without supervision to make some kind of homemade fireworks. I’m worried they are going to cause an explosion.,24,1.31,1,1,M,India
Internship Opportunities,Students with disabilities are not given tailored career support for employment.,22,2.37,3,1,F,Turkey
Food and Cantines,Food prices at the campus canteen increased this semester without any notice.,20,3.0,4,1,M,Egypt
Student Activities,There is no support for students who want to start entirely new societies on campus.,21,3.03,3,1,F,India
Health and Well-being Support,There are no mindfulness sessions offered during the exam period when stress peaks.,26,0.82,3,1,F,Malaysia
International student experiences,The buddy system for international students is poorly organized and rarely works.,28,3.84,4,1,M,Indonesia
Food and Cantines,There are no late-night food kiosks near the dormitory buildings at all.,25,3.42,4,1,M,Bangladesh
Online learning,"Due to server problems in the IUMS system, I was unable to check my result on the publication day and had to wait until the next day.",22,2.66,4,1,M,Malaysia
Student Affairs,University sexual harassment policies are not clearly communicated to all students.,27,3.3,5,1,F,Nigeria
Online learning, The lack of access to campus facilities like libraries and study spaces can make it harder to study and complete coursework.,20,0.06,3,1,M,Mexico
Online learning,I cannot download my own submitted assignments from the portal to keep records.,26,1.73,2,1,F,Indonesia
Student Activities,Club budgets are cut mid-semester without any notice to the affected clubs.,24,2.03,1,1,F,Jordan
Food and Cantines,The canteen food has been cold every single day this semester with no improvement.,25,0.35,1,1,M,Malaysia
Housing and Transportation,WiFi in the dormitory rooms is consistently slow and unreliable throughout the day.,24,0.33,4,1,F,Jordan
Athletics and sports,The gym locker rooms are poorly maintained and frequently left in a dirty state.,23,2.35,1,1,F,Indonesia
Student Affairs,I need to change my legal name in the system following my marriage. I have all the court documents ready. Can I do this via email or do I have to come in?,25,2.23,5,1,M,Pakistan
Internship Opportunities,The university should work with local businesses and organizations to offer more job opportunities to students.,20,2.06,5,1,F,Egypt
Student Affairs,"I received an ""Academic Probation"" warning, but my GPA is 3.8. There is clearly a glitch in the data processing for the Faculty of Engineering. This is causing me a lot of unnecessary stress.",27,1.32,2,1,F,Jordan
Internship Opportunities,Students are never taught salary negotiation skills or how to read a contract.,21,3.11,3,1,F,Indonesia
Health and Well-being Support,There is no proactive outreach to students who miss classes due to health issues.,28,2.07,5,1,M,India
Financial Support,I was charged for a course I officially withdrew from and the refund is pending.,27,2.51,1,1,F,Turkey
